<?xml version="1.0" encoding="UTF-8" ?>
<gems  xmlns:xsi="http://www.w3.org/2001/XMLSchema-instance" xsi:noNamespaceSchemaLocation="gems.xsd" Id="Anton123">

    <Precious>
        <name>Diamond</name>
        <origin>Russia</origin>
        <hardness>10</hardness>
        <value >5</value>
        <timeOfExtraction>2020-03</timeOfExtraction>
        <visualParameters>
            <color>Colorless</color>
            <transparency>100</transparency>
        </visualParameters>
    </Precious>
    <Precious>
        <name>Emerald</name>
        <origin>Columbia</origin>
        <hardness>8</hardness>
        <value>4</value>
        <timeOfExtraction>2020-04</timeOfExtraction>
        <visualParameters>
            <color>Green</color>
            <transparency>98</transparency>
        </visualParameters>
    </Precious>
    <Precious>
        <name>Ruby</name>
        <origin>Myanmar</origin>
        <hardness>9</hardness>
        <value>10</value>
        <timeOfExtraction>2020-05</timeOfExtraction>
        <visualParameters>
            <color>Red</color>
            <transparency>99</transparency>
        </visualParameters>
    </Precious>
    <Precious>
        <name>Sapphire</name>
        <origin>USA</origin>
        <hardness>9</hardness>
        <value>5</value>
        <timeOfExtraction>2020-01</timeOfExtraction>
        <visualParameters>
            <color>Blue</color>
            <transparency>95</transparency>
        </visualParameters>
    </Precious>
    <Semiprecious>
        <name>Aquamarine</name>
        <origin>Russia</origin>
        <hardness>8</hardness>
        <value>5</value>
        <timeOfExtraction>2021-03</timeOfExtraction>
        <visualParameters>
            <color>Blue</color>
            <transparency>99</transparency>
        </visualParameters>
    </Semiprecious>
    <Precious>
        <name>Beryl</name>
        <origin>Brazil</origin>
        <hardness>8</hardness>
        <value>50</value>
        <timeOfExtraction>2021-01</timeOfExtraction>
        <visualParameters>
            <color>Colorless</color>
            <transparency>99</transparency>
        </visualParameters>
    </Precious>
    <Precious>
        <name>Alexandrite</name>
        <origin>Russia</origin>
        <hardness>8</hardness>
        <value>1</value>
        <timeOfExtraction>2020-06</timeOfExtraction>
        <visualParameters>
            <color>Purple</color>
            <transparency>98</transparency>
        </visualParameters>
    </Precious>
    <Semiprecious>
        <name>Pirop</name>
        <origin>Czech</origin>
        <hardness>7</hardness>
        <value>10</value>
        <timeOfExtraction>2020-09</timeOfExtraction>
        <visualParameters>
            <color>Red</color>
            <transparency>80</transparency>
        </visualParameters>
    </Semiprecious>
    <Semiprecious>
        <name>Amethyst</name>
        <origin>Brazil</origin>
        <hardness>7</hardness>
        <value>6</value>
        <timeOfExtraction>2021-02</timeOfExtraction>
        <visualParameters>
            <color>Purple</color>
            <transparency>90</transparency>
        </visualParameters>
    </Semiprecious>
    <Semiprecious>
        <name>Tourmaline</name>
        <origin>Madagascar</origin>
        <hardness>7</hardness>
        <value>8</value>
        <timeOfExtraction>2020-10</timeOfExtraction>
        <visualParameters>
            <color>Red</color>
            <transparency>85</transparency>
        </visualParameters>
    </Semiprecious>
    <Semiprecious>
        <name>Topaz</name>
        <origin>Russia</origin>
        <hardness>7</hardness>
        <value>10</value>
        <timeOfExtraction>2020-12</timeOfExtraction>
        <visualParameters>
            <color>Viol</color>
            <transparency>80</transparency>
        </visualParameters>
    </Semiprecious>
    <Semiprecious>
        <name>Tanzanite</name>
        <origin>Tanzania</origin>
        <hardness>6</hardness>
        <value>11</value>
        <timeOfExtraction>2020-07</timeOfExtraction>
        <visualParameters>
            <color>Blue</color>
            <transparency>95</transparency>
        </visualParameters>
    </Semiprecious>
    <Precious>
        <name>Emerald</name>
        <origin>Columbia</origin>
        <hardness>8</hardness>
        <value>20</value>
        <timeOfExtraction>2020-06</timeOfExtraction>
        <visualParameters>
            <color>Green</color>
            <transparency>90</transparency>
        </visualParameters>
    </Precious>
    <Precious>
        <name>Ruby</name>
        <origin>Myanmar</origin>
        <hardness>9</hardness>
        <value>5</value>
        <timeOfExtraction>2020-02</timeOfExtraction>
        <visualParameters>
            <color>Red</color>
            <transparency>96</transparency>
        </visualParameters>
    </Precious>
    <Semiprecious>
        <name>Amethyst</name>
        <origin>Brazil</origin>
        <hardness>7</hardness>
        <value>15</value>
        <timeOfExtraction>2020-02</timeOfExtraction>
        <visualParameters>
            <color>Purple</color>
            <transparency>97</transparency>
        </visualParameters>
    </Semiprecious>
    <Semiprecious>
        <name>Tourmaline</name>
        <origin>South Africa</origin>
        <hardness>7</hardness>
        <value>30</value>
        <timeOfExtraction>2020-01</timeOfExtraction>
        <visualParameters>
            <color>Green</color>
            <transparency>90</transparency>
        </visualParameters>
    </Semiprecious>
</gems>
